{
    "name": "sadSalon_2A",
    "flags": [
        {
            "name": "grandmaGreeted",
            "value": false
        }
    ],
    "endEventCondition": "grandmaGreeted",
    "player": {
        "playerId": "Clara",
        "actorId": "Clara",
        "startPosition": [
            10,
            13
        ]
    },
    "enemies": [],
    "npcs": [
        {
            "actorId": "Dancer1",
            "position": [
                3,
                10
            ],
            "dialogue": "sad_notGrandma.json",
            "isInteractableConditions": "true",
            "flagChangesAfterInteraction": []
        },
        {
            "actorId": "Dancer2",
            "position": [
                14,
                13
            ],
            "dialogue": "sad_notGrandma.json",
            "isInteractableConditions": "true",
            "flagChangesAfterInteraction": []
        },
        {
            "actorId": "Dancer3",
            "position": [
                7,
                17
            ],
            "dialogue": "sad_notGrandma.json",
            "isInteractableConditions": "true",
            "flagChangesAfterInteraction": []
        },
        {
            "actorId": "Grandma",
            "position": [
                15,
                15
            ],
            "dialogue": "nervousTalkGrandma.json",
            "isInteractableConditions": "not grandmaGreeted",
            "flagChangesAfterInteraction": [
                {
                    "name": "grandmaGreeted",
                    "value": "true"
                }
            ]
        }
    ],
    "items": []
}