{
    "name": "disgust&happy_talkAllGuests",
    "flags": [
        {
            "name": "grandmaGreeted",
            "value": false
        },
        {
            "name": "noGuestsGreeted",
            "value": 0
        },
        {
            "name": "guest1Greeted",
            "value": false
        },
        {
            "name": "guest2Greeted",
            "value": false
        },
        {
            "name": "guest3Greeted",
            "value": false
        }
    ],
    "endEventCondition": "noGuestsGreeted == 3 and grandmaGreeted",
    "player": {
        "playerId": "Clara",
        "actorId": "Clara",
        "startPosition": "current"
    },
    "enemies": [],
    "npcs": [
        {
            "actorId": "Uncle",
            "position": [
                2,
                10
            ],
            "dialogue": "happyUncle.json",
            "isInteractableConditions": "not guest1Greeted",
            "flagChangesAfterInteraction": [
                {
                    "name": "guest1Greeted",
                    "value": "true"
                },
                {
                    "name": "noGuestsGreeted",
                    "value": "noGuestsGreeted + 1"
                }
            ]
        },
        {
            "actorId": "Guest3",
            "position": [
                17,
                11
            ],
            "dialogue": "happyGroup.json",
            "isInteractableConditions": "not guest2Greeted",
            "flagChangesAfterInteraction": [
                {
                    "name": "guest2Greeted",
                    "value": "true"
                },
                {
                    "name": "noGuestsGreeted",
                    "value": "noGuestsGreeted + 1"
                }
            ]
        },
        {
            "actorId": "Guest2",
            "position": [
                18,
                12
            ],
            "dialogue": "happyGroup.json",
            "isInteractableConditions": "false",
            "flagChangesAfterInteraction": []
        },
        {
            "actorId": "Guest1",
            "position": [
                5,
                15
            ],
            "dialogue": "disgustedGuest.json",
            "isInteractableConditions": "not guest3Greeted",
            "flagChangesAfterInteraction": [
                {
                    "name": "guest3Greeted",
                    "value": "true"
                },
                {
                    "name": "noGuestsGreeted",
                    "value": "noGuestsGreeted + 1"
                }
            ]
        },
        {
            "actorId": "Grandma",
            "position": [
                17,
                15
            ],
            "dialogue": "talkGrandma.json",
            "isInteractableConditions": "not grandmaGreeted",
            "flagChangesAfterInteraction": [
                {
                    "name": "grandmaGreeted",
                    "value": "true"
                }
            ]
        }
    ],
    "items": []
}