{
    "name": "happySalon_2A",
    "flags": [
        {
            "name": "grandmaGreeted",
            "value": false
        }
    ],
    "endEventCondition": "grandmaGreeted",
    "player": {
        "playerId": "Clara",
        "actorId": "Clara",
        "startPosition": [
            10,
            11
        ]
    },
    "enemies": [],
    "npcs": [
        {
            "actorId": "Uncle",
            "position": [
                3,
                11
            ],
            "dialogue": "notGrandma.json",
            "isInteractableConditions": "true",
            "flagChangesAfterInteraction": []
        },
        {
            "actorId": "Guest3",
            "position": [
                17,
                11
            ],
            "dialogue": "notGrandma.json",
            "isInteractableConditions": "true",
            "flagChangesAfterInteraction": []
        },
        {
            "actorId": "Guest2",
            "position": [
                18,
                12
            ],
            "dialogue": "notGrandma.json",
            "isInteractableConditions": "false",
            "flagChangesAfterInteraction": []
        },
        {
            "actorId": "Guest1",
            "position": [
                5,
                15
            ],
            "dialogue": "notGrandma.json",
            "isInteractableConditions": "true",
            "flagChangesAfterInteraction": []
        },
        {
            "actorId": "Grandma",
            "position": [
                13,
                15
            ],
            "dialogue": "nervousTalkGrandma.json",
            "isInteractableConditions": "not grandmaGreeted",
            "flagChangesAfterInteraction": [
                {
                    "name": "grandmaGreeted",
                    "value": "true"
                }
            ]
        }
    ],
    "items": []
}