{
    "name": "happySalon_3A",
    "flags": [{
            "name": "grandmaGreeted",
            "value": false
        },
        {
            "name": "noGuestsGreeted",
            "value": 0
        },
        {
            "name": "guest1Greeted",
            "value": false
        },
        {
            "name": "guest2Greeted",
            "value": false
        },
        {
            "name": "guest3Greeted",
            "value": false
        }
    ],
    "endEventCondition": "noGuestsGreeted == 3 and grandmaGreeted",
    "player": {
        "playerId": "Clara",
        "actorId": "Clara",
        "startPosition": "current"
    },
    "enemies": [],
    "npcs": [{
            "actorId": "Dancer1",
            "position": [
                3,
                10
            ],
            "dialogue": "talkGuest.json",
            "isInteractableConditions": "not guest1Greeted",
            "flagChangesAfterInteraction": [{
                    "name": "guest1Greeted",
                    "value": "true"
                },
                {
                    "name": "noGuestsGreeted",
                    "value": "noGuestsGreeted + 1"
                }
            ]
        },
        {
            "actorId": "Dancer2",
            "position": [
                14,
                13
            ],
            "dialogue": "talkGuest.json",
            "isInteractableConditions": "not guest2Greeted",
            "flagChangesAfterInteraction": [{
                    "name": "guest2Greeted",
                    "value": "true"
                },
                {
                    "name": "noGuestsGreeted",
                    "value": "noGuestsGreeted + 1"
                }
            ]
        },
        {
            "actorId": "Dancer3",
            "position": [
                7,
                17
            ],
            "dialogue": "talkGuest.json",
            "isInteractableConditions": "not guest3Greeted",
            "flagChangesAfterInteraction": [{
                    "name": "guest3Greeted",
                    "value": "true"
                },
                {
                    "name": "noGuestsGreeted",
                    "value": "noGuestsGreeted + 1"
                }
            ]
        },
        {
            "actorId": "Grandma",
            "position": [
                15,
                15
            ],
            "dialogue": "talkGrandma.json",
            "isInteractableConditions": "not grandmaGreeted",
            "flagChangesAfterInteraction": [{
                "name": "grandmaGreeted",
                "value": "true"
            }]
        }
    ],
    "items": []
}